<?xml version="1.0" encoding="UTF-8"?>
<?xml-stylesheet type="text/xsl" href="Cursos.xsl"?>

<evento 
    nombre="Semana de Ingenierías - Tecnológico de Orizaba"
    carrera="Ingeniería en Sistemas Computacionales"
    xmlns:xsi="http://www.w3.org/2001/XMLSchema-instance"
    xsi:noNamespaceSchemaLocation="Cursos.xsd">

    <curso id="1">
        <nombre>Desarrollo Web con React</nombre>
        <ponente>Ing. Carlos Hernández</ponente>
        <duracion>5</duracion>
        <modalidad>Presencial</modalidad>
        <dia>Lunes</dia>
    </curso>

    <curso id="2">
        <nombre>Introducción a Ciberseguridad</nombre>
        <ponente>Mtra. Laura Méndez</ponente>
        <duracion>4</duracion>
        <modalidad>Presencial</modalidad>
        <dia>Martes</dia>
    </curso>

    <curso id="3">
        <nombre>Inteligencia Artificial con Python</nombre>
        <ponente>Dr. Jorge Ramírez</ponente>
        <duracion>6</duracion>
        <modalidad>Híbrido</modalidad>
        <dia>Miércoles</dia>
    </curso>

    <curso id="4">
        <nombre>Desarrollo de Apps con Flutter</nombre>
        <ponente>Ing. Mariana López</ponente>
        <duracion>5</duracion>
        <modalidad>Presencial</modalidad>
        <dia>Jueves</dia>
    </curso>

    <curso id="5">
        <nombre>Administración de Servidores Linux</nombre>
        <ponente>Ing. Ricardo Torres</ponente>
        <duracion>4</duracion>
        <modalidad>Presencial</modalidad>
        <dia>Viernes</dia>
    </curso>

    <curso id="6">
        <nombre>Machine Learning Aplicado</nombre>
        <ponente>Dra. Patricia Gómez</ponente>
        <duracion>6</duracion>
        <modalidad>Híbrido</modalidad>
        <dia>Lunes</dia>
    </curso>

    <curso id="7">
        <nombre>Redes y Seguridad Informática</nombre>
        <ponente>Ing. Fernando Castillo</ponente>
        <duracion>4</duracion>
        <modalidad>Presencial</modalidad>
        <dia>Martes</dia>
    </curso>

</evento>